SKU	Product ID	Short Description	Category Name	Brand	Model	Image Link	Product URL	Price	Shipment Costs
MICGZA-00278	365	Personalize your documents | Stay organized | Create professional-looking documents	Office Suite	Microsoft	Microsoft Office Mac 2011 Home and Student	http://www.wireless1.com.au/media/catalog/product/m/i/microsoft_office_mac_home_and_student_2011.jpg	http://www.wireless1.com.au/accessories/software/office-suite/microsoft-office-mac-2011-home-student	169.00	
MICSKU-T5D-01798	366	Personalize your documents | Stay organized | Create professional-looking documents	Office Suite	Microsoft	Microsoft Office Home and Business 2013 1PC	http://www.wireless1.com.au/media/catalog/product/m/i/microsoft_office_home_business_2013_1pc_1_.jpg	http://www.wireless1.com.au/accessories/software/office-suite/microsoft-office-home-business-2013-1pc	249.00	
STMDP-0521-1	367	Fits most 13" screens | Plush power corduroy lining and high density foam padding | Zippered front pockets | Hidden front slider	Bags &amp; Sleeves	STM	STM DP-0521-1 Slim (S-13 inch) - Black	http://www.wireless1.com.au/media/catalog/product/s/t/stm-dp-0521-1-slim-_s-13_---black_ps1.jpg	http://www.wireless1.com.au/accessories/laptop-accessories/bags-sleeves/stm-dp-0521-1-slim-s-13-black	79.00	
STMDP-0521-11	368	Fits most 13" screens | Plush power corduroy lining and high density foam padding | Hidden front slider | Slip pocket on back	Bags &amp; Sleeves	STM	STM DP-0521-11 Slim (S-13 inch) - Berry	http://www.wireless1.com.au/media/catalog/product/s/t/stm-dp-0521-11-slim-_s-13_---berry_ps1.jpg	http://www.wireless1.com.au/accessories/laptop-accessories/bags-sleeves/stm-dp-0521-11-slim-s-13-berry	79.00	
STMDP-0522-1	369	Fits most 15" screen | Plush power corduroy lining and high density foam padding | Zippered front pockets | Hidden front slide	Bags &amp; Sleeves	STM	STM DP-0522-1 Slim (M-15 inch) - Black	http://www.wireless1.com.au/media/catalog/product/s/t/stm-dp-0522-1-slim-_m-15_---black_ps1.jpg	http://www.wireless1.com.au/accessories/laptop-accessories/bags-sleeves/stm-dp-0522-1-slim-m-15-black	89.00	
STMDP-1802-01	370	Holds most 13" laptops | High density padding | Secure easy open buckle for main compartment 	Bags &amp; Sleeves	STM	STM DP-1802-01 SCOUT2 (M-13 inch) - Olive	http://www.wireless1.com.au/media/catalog/product/s/t/stm-dp-1802-01-scout2-_m-13_---olive_ps1.jpg	http://www.wireless1.com.au/accessories/laptop-accessories/bags-sleeves/stm-dp-1802-01-scout2-m-13-olive	59.00	
STMDP-1803-01	371	Holds most 15" laptops | Super-comfortable shoulder pad | Large main compartment | Front utility pockets	Bags &amp; Sleeves	STM	STM DP-1803-01 SCOUT2 (M-15 inch) - Olive	http://www.wireless1.com.au/media/catalog/product/s/t/stm-dp-1803-01-scout2-_m-15_---olive_ps1.jpg	http://www.wireless1.com.au/accessories/laptop-accessories/bags-sleeves/stm-dp-1803-01-scout2-m-15-olive	69.00	
STMDP-2142-2	372	Fits Most 15" screens | Super soft interior lining cradles your laptop | Zippered front pocket	Bags &amp; Sleeves	STM	STM DP-2142-2 Jacket (M-15 inch) - Choc/orange	http://www.wireless1.com.au/media/catalog/product/d/p/dp-2142-2.jpg	http://www.wireless1.com.au/accessories/laptop-accessories/bags-sleeves/stm-dp-2142-2-jacket-m-15-choc-orange	49.00	
STMDP-3000-2	373	Concealed, plush lined laptop section keeps your digital investment protected, safe and secure | Integrated iPad pocket with unique fingerprint-removing brushed nylex | Main compartment for books, paperwork, reading materials	Bags &amp; Sleeves	STM	STM DP-3000-2 Revolution (S-13 inch) - Carb/blk	http://www.wireless1.com.au/media/catalog/product/s/t/stm-dp-3000-2-revolution-_s-13_---carbblk_ps1.jpg	http://www.wireless1.com.au/accessories/laptop-accessories/bags-sleeves/stm-dp-3000-2-revolution-s-13-carb-blk	89.00	
STMDP-4103-16	374	Fits most 15" screens | Spacious internal compartment with space divider | External organiser pocket	Bags &amp; Sleeves	STM	STM Ranger (S-13INCH) - Graphite	http://www.wireless1.com.au/media/catalog/product/s/t/stm-ranger-_s-13inch__ps1.jpg	http://www.wireless1.com.au/accessories/laptop-accessories/bags-sleeves/stm-ranger-s-13inch-graphite	79.95	
STMSTM-112-025P-01	375	Designed to fit most 15" laptops | Main flap secured with two quick release buckles and interior zippered compartment for further security	Bags &amp; Sleeves	STM	STM VELO2 (M-15 inch) - Black ( STM-112-025P-01 )	http://www.wireless1.com.au/media/catalog/product/s/t/stm-112-025p-01-velo2-_m-15_---black_ps1.jpg	http://www.wireless1.com.au/accessories/laptop-accessories/bags-sleeves/stm-stm-112-025p-01-velo2-m-15-black	99.00	
SYMN36021AU1U3DRET	376	Repel online invaders | Protection from today's and tomorrow's threats | Files and memories protected	Anti-Virus &amp; Security	Symantec	Norton 360 V21.0 AU 1 User 3 Devices Retail Box	http://www.wireless1.com.au/media/catalog/product/n/o/norton_360_retail_3users_1_.jpg	http://www.wireless1.com.au/accessories/software/anti-virus-security/norton-360-21-0-au-1-user-3-devices-retail-box	79.00	
SYMNORTON360_21OEM	377	OEM VERSION | Repel online invaders | Protection from today's and tomorrow's threats | Files and memories protected	Anti-Virus &amp; Security	Symantec	Norton 360 V21.0 AU 1 User 3 Devices OEM	http://www.wireless1.com.au/media/catalog/product/n/o/norton-360-v21-oem-3-pcs_ps6.jpg	http://www.wireless1.com.au/accessories/software/anti-virus-security/norton-360-v21-oem-3-pcs	59.00	
SYMNORTON360MULTI	378	Protection for up to 5 devices | Stay secure when you surf, shop and bank online | Stops both today's and tomorrow's threats	Anti-Virus &amp; Security	Symantec	Norton 360 Multi-device 5 Licences	http://www.wireless1.com.au/media/catalog/product/n/o/norton_360_5licences_1_.jpg	http://www.wireless1.com.au/accessories/software/anti-virus-security/norton-360-multi-device-5-licences	70.00	
APPMF322XA_VOD	379	4" | 8MP | Dual-core 1.3 GHz Swift | 16GB | iOS 7, upgradable to iOS 7.1.1	iPhone	Apple	Apple iPhone 5C Yellow 16GB Vodafone	http://www.wireless1.com.au/media/catalog/product/i/p/iphone5c_ylw_1__1.jpg	http://www.wireless1.com.au/mobile-phones/mobile-phone-type/apple-iphone-5c-yellow-16gb-vodafone	739.00	
APPMF328XA_VOD	380	4" | 8MP | Dual-core 1.3 GHz Swift | 32GB | iOS 7, upgradable to iOS 7.1.1	iPhone	Apple	Apple iPhone 5C Blue 32GB Vodafone	http://www.wireless1.com.au/media/catalog/product/a/p/apple_iphone5c_blw_1__1.jpg	http://www.wireless1.com.au/mobile-phones/mobile-phone-type/apple-iphone-5c-blue-32gb-vodafone	849.00	
APPMF329XA_VOD	381	4" | 8MP | Dual-core 1.3 GHz Swift | 32GB | iOS 7, upgradable to iOS 7.1.1	iPhone	Apple	Apple 5C iPhone Green 32GB Vodafone	http://www.wireless1.com.au/media/catalog/product/a/p/apple_iphone5c_grn_1__1.jpg	http://www.wireless1.com.au/mobile-phones/mobile-phone-type/apple-5c-iphone-green-32gb-vodafone	849.00	
APPMF330XA_VOD	382	4" | 8MP | Dual-core 1.3 GHz Swift | 32GB | iOS 7, upgradable to iOS 7.1.1	iPhone	Apple	Apple iPhone 5C Pink 32GB Vodafone	http://www.wireless1.com.au/media/catalog/product/a/p/apple_iphone5c_pk_1_.jpg	http://www.wireless1.com.au/mobile-phones/mobile-phone-type/apple-iphone-5c-pink-32gb-vodafone	849.00	
APPMG162XA_VOD	384	4" | 8MP | Dual-core 1.3 GHz Swift | 8GB | iOS 7, upgradable to iOS 7.1.1	iPhone	Apple	Apple iPhone 5C Green 8GB Vodafone	http://www.wireless1.com.au/media/catalog/product/a/p/apple_iphone5c_grn_1_.jpg	http://www.wireless1.com.au/mobile-phones/mobile-phone-type/apple-iphone-5c-green-8gb-vodafone	599.00	
ASU90OK0GB1102370W_RFB	395	10.1" LED HD | Tegra 3 Quad-Core 1.3GHz | 32GB | 1GB RAM | Wi-Fi | Android 4.0 | Comes with Keyboard Dock	Refurbished	Asus	Asus TF300T-1A098A Refurbished Tablet	http://www.wireless1.com.au/media/catalog/product/t/f/tf300t-1a098a_1_.jpg	http://www.wireless1.com.au/tablets/tablet-type/refurbished/asus-tf300t-1a098a-refurbished-tablet	349.00	
ASU90OK0GB4102380W_RFB	396	10.1" LED HD | Tegra 3 Quad-Core 1.3GHz | 32GB | 1GB RAM | Wi-Fi | Android 4.0Comes with Keyboard Dock	Refurbished	Asus	Asus TF300T-1K101A Refurbished Tablet	http://www.wireless1.com.au/media/catalog/product/t/f/tf300t-1k101a_1_.jpg	http://www.wireless1.com.au/tablets/tablet-type/refurbished/asus-tf300t-1k101a-refurbished-tablet	349.00	
ASU90OK0GB4102390W_RFB	397	10.1" LED HD | Tegra 3 Quad-Core 1.3GHz | 32GB | 1GB RAM | Wi-Fi | Android 4.0	Refurbished	Asus	Asus TF300T-1K102A Refurbished Tablet	http://www.wireless1.com.au/media/catalog/product/t/f/tf300t-1k102a_1_.jpg	http://www.wireless1.com.au/tablets/tablet-type/refurbished/asus-tf300t-1k102a-refurbished-tablet	349.00	
ASU90OK0GB5103750W_RFB	398	10.1" LED HD | Tegra 3 Quad-Core 1.3GHz | 32GB | 1GB RAM | Wi-Fi | Android 4.0	Refurbished	Asus	Asus TF300T-1G027A Refurbished Tablet	http://www.wireless1.com.au/media/catalog/product/t/f/tf300t-1g027a_1_.jpg	http://www.wireless1.com.au/tablets/tablet-type/refurbished/asus-tf300t-1g027a-refurbished-tablet	349.00	
ASU90OK0JB4103340W_RFB	399	10.1" LED HD | Tegra 3 Quad-Core 1.3GHz | 32GB | 1GB RAM | Wi-Fi + 4G | Android 4.0	Refurbished	Asus	Asus TF300TG-1K118A Refurbished Tablet	http://www.wireless1.com.au/media/catalog/product/t/f/tf300tg-1k118a_1_.jpg	http://www.wireless1.com.au/tablets/tablet-type/refurbished/asus-tf300tg-1k118a-refurbished-tablet	399.00	
ASU90OK0XB1100690U_RFB	401	10.1" IPS LED HD | Intel Atom Z2760 1.6GHz Dual-core | 64GB | 2GB RAM | Wi-Fi | Windows 8	Refurbished	Asus	Asus ME400C-1A032W 64GB White Refurbished Tablet	http://www.wireless1.com.au/media/catalog/product/m/e/me400c-1a032w_1_.jpg	http://www.wireless1.com.au/tablets/tablet-type/refurbished/asus-eee-pad-64gb-wifi-white-refurbished-tablet	299.00	
ASU90OK0XB2100640U_RFB	402	10.1" IPS LED HD | Intel Atom Z2760 1.6GHz Dual-core | 64GB | 2GB RAM | Wi-Fi | Windows 8	Windows	Asus	Asus ME400C-1B035W 64GB Black Refurbished Tablet	http://www.wireless1.com.au/media/catalog/product/m/e/me400c-1b035w_1_.jpg	http://www.wireless1.com.au/tablets/tablet-type/asus-eee-pad-64gb-wifi-black-refurbished-tablet	299.00	
ASU90R-N00WR1300T	404	Extend your notebook warranty and service level and save possible repair cost, precious time and ensure your notebook will continue to perform at its peak conditions	Ultrabooks	Asus	Asus Premium Care 2 Years Local Warranty Extension	http://www.wireless1.com.au/media/catalog/product/a/s/asus-premium-care_ps3.jpg	http://www.wireless1.com.au/laptops/laptop-type/asus-premium-care-2-years-local-warranty-extension	149.00	
BESCB-USB3-MICRO	414	For use with devices that have a Micro USB 3.0 port	USB	Generic	Micro USB 3.0 Cable 0.8M	http://www.wireless1.com.au/media/catalog/product/m/i/microusb3_cable_blue.jpg	http://www.wireless1.com.au/accessories/cables/usb/micro-usb-3-0-cable-0-8m	19.00	
ELGX1SK109901000	426	Never forget your keys again with Elgato Smartkey, connect to your iPhone via bluetooth for your peace of mind	Car Kits &amp; Accessories	Elgato	Elgato Smart Key	http://www.wireless1.com.au/media/catalog/product/6/1/61vdf4bjnfl._sl1500_.jpg	http://www.wireless1.com.au/accessories/mobile-phone-accessories/car-kits-accessories/elgato-smart-key	79.00	
HHHCBH0214	447	For use with any device using the HDMI connection to connect to a TV or monitor	HDMI/DVI	Generic	HDMI Male to Male Cable 1.4V 2M	http://www.wireless1.com.au/media/catalog/product/h/d/hdmi_maletomale.jpg	http://www.wireless1.com.au/accessories/cables/hdmi-dvi/hdmi-male-to-male-cable-1-4v-2m	15.00	
HHHDPMINI-HDMI	450	Converts the Mini DisplayPort connection to HDMI	HDMI/DVI	Generic	Mini Display Port to HDMI  [ Display Adapter ]	http://www.wireless1.com.au/media/catalog/product/m/i/minidptohdmi_adapter.jpg	http://www.wireless1.com.au/accessories/cables/hdmi-dvi/mini-display-port-to-hdmi-adapter	29.00	
HHHUSBREEXT	453	USB 2.0 Extension Cable, retractable for easy storage.	USB	Generic	0.75M Retractable USB Extension Cable	http://www.wireless1.com.au/media/catalog/product/u/s/usbextensionrectract.jpg	http://www.wireless1.com.au/accessories/cables/usb/retractable-usb-extension-cable-0-75m	15.00	
HUAASCENDY100	456	2.8" Touch | 3MP (2048 x 1536 pixels) | 800MHz | 256MB | Android OS 2.3 Gingerbread	Android	Huawei	Huawei Ascend Y100	http://www.wireless1.com.au/media/catalog/product/h/u/huawei-ascend-y100_ps1.jpg	http://www.wireless1.com.au/mobile-phones/mobile-phone-type/huawei-ascend-y100	58.00	
HUAU8180	457	2.8" Touch | 3MP | 528 MHz Qualcomm MSM7225 CPU | 512 MB ROM microSD up to 32 GB | Android OS, v2.2 (Froyo)	Android	Huawei	Huawei X1 U8180	http://www.wireless1.com.au/media/catalog/product/h/u/huawei-x1-u8180_ps1.jpg	http://www.wireless1.com.au/mobile-phones/mobile-phone-type/huawei-x1-u8180	99.00	
HUNHKA06519533-8L	458	65W Slim Universal Notebook Adapter is a product designed to complement light and thin compact notebooks.	Power Adaptors	Huntkey	Huntkey Universal Laptop Adapter Slim 65W	http://www.wireless1.com.au/media/catalog/product/h/u/hunt65w_3.jpg	http://www.wireless1.com.au/accessories/laptop-accessories/power-adaptors/huntkey-universal-laptop-adapter-slim-65w	69.00	
HUNHKA09019047-8E	459	The Huntkey 90W car charger is a car charger with both a USB and a notebook port. It allows easy re-charging of notebooks, tablets, cell phones and other digital devices in your car. The DC wire, which is connected to the notebook port, is removable in order to minimize cable clutter.	Power Adaptors	Huntkey	Huntkey Universal Notebook Adapter 90W  [ Car Charger ]	http://www.wireless1.com.au/media/catalog/product/h/u/huntkey_90w_slim_universal_notebook_adapter.jpg	http://www.wireless1.com.au/accessories/laptop-accessories/power-adaptors/huntkey-universal-notebook-adapter-90w-carcharger	99.00	
HUNHKA09019546-8P	460	Charge your laptop with this HuntKey 90W Notebook AC Adapter.	Power Adaptors	Huntkey	Huntkey Universal Laptop Adapter 90W [ Notebook Charger ]	http://www.wireless1.com.au/media/catalog/product/h/u/huntley.jpg	http://www.wireless1.com.au/accessories/laptop-accessories/power-adaptors/huntkey-universal-laptop-adapter-90w	89.00	
HYTFIBERCABLE2M	461	Suitable for Surround Sound Audio Systems	Audio	Generic	Hytec 2M Toslink Digital Audio Optical Cable [ Audio Cable ]	http://www.wireless1.com.au/media/catalog/product/f/i/fibercable_optical.jpg	http://www.wireless1.com.au/accessories/cables/audio/hytec-toslink-digital-audio-optical-cable-2m	15.00	
HYTHDMI-DVI2M	463	Connect a DVI-I source to HDMI or vice versa	HDMI/DVI	Generic	Hytec 2M HDMI to Dvi Cable [ Display Adapter ]	http://www.wireless1.com.au/media/catalog/product/d/v/dvihdmi_cableblk.jpg	http://www.wireless1.com.au/accessories/cables/hdmi-dvi/hytec-hdmi-to-dvi-cable-2m	19.00	
HYTUSBTOMICROCABLE	465	Suitable for devices with a Micro USB 2.0 port	USB	Generic	Hytec USB to Micro USB Cable 1.5M	http://www.wireless1.com.au/media/catalog/product/u/s/usbmicro_cableblk.jpg	http://www.wireless1.com.au/accessories/cables/usb/hytec-usb-to-micro-usb-cable-1-5m	29.00	
JACJHBTSBLK	475	Let the music take control with the Jackhead portable bluetooth speaker. With up to 10m range and 25 hours of nonstop usage, take your favourite music with you anywhere, anytime.	Speakers	Jackhead	Jackhead Bluetooth Speaker Black	http://www.wireless1.com.au/media/catalog/product/b/l/blackmain.jpg	http://www.wireless1.com.au/audio/audio/jackhead-bluetooth-speaker-black	39.00	
JACJHBTSBLU	476	Let the music take control with the Jackhead portable bluetooth speaker. With up to 10m range and 25 hours of nonstop usage, take your favourite music with you anywhere, anytime.	Speakers	Jackhead	Jackhead Bluetooth Speaker Blue	http://www.wireless1.com.au/media/catalog/product/b/l/bluemain.jpg	http://www.wireless1.com.au/audio/audio/jackhead-bluetooth-speaker-blue	39.00	
JACJHBTSGRN	477	Let the music take control with the Jackhead portable bluetooth speaker. With up to 10m range and 25 hours of nonstop usage, take your favourite music with you anywhere, anytime.	Speakers	Jackhead	Jackhead Bluetooth Speaker Green	http://www.wireless1.com.au/media/catalog/product/g/r/greenmain.jpg	http://www.wireless1.com.au/audio/audio/jackhead-bluetooth-speaker-green	39.00	
JACJHBTSRED	478	Let the music take control with the Jackhead portable bluetooth speaker. With up to 10m range and 25 hours of nonstop usage, take your favourite music with you anywhere, anytime.	Speakers	Jackhead	Jackhead Bluetooth Speaker Red	http://www.wireless1.com.au/media/catalog/product/r/e/redmain.jpg	http://www.wireless1.com.au/audio/audio/jackhead-bluetooth-speaker-red	39.00	
LANAFSP100E	479	Value your workspace | Value higher quality | Value your time	Laser Black &amp; White	Ricoh Lanier	Ricoh Lanier Aficio SP100E Black and White Laser Printer	http://www.wireless1.com.au/media/catalog/product/r/i/ricoh-lanier-aficio-sp100e.jpg	http://www.wireless1.com.au/accessories/printers/laser-black-white/ricoh-lanier-aficio-sp100e-b-w-laser-printer	199.00	
LANAFSP204SF	480	22 pages per minute | LCD operation panel | 1200 dpi | Budget-friendly 	Multifunctions	Ricoh Lanier	Lanier Aficio SP204SF Black and White Multifunction Laser Printer [ Printer ]	http://www.wireless1.com.au/media/catalog/product/r/i/ricoh-lanier-aficio-sp204sf.jpg	http://www.wireless1.com.au/accessories/printers/multifunctions/lanier-aficio-sp204sf-b-w-multifnctn-laser-printer	149.00	
LANSP1210N	481	22 prints per minute | 2499 x 600 dpi	Laser Black &amp; White	Ricoh Lanier	Lanier SP1210N Black and White Laser Printer [ Printer ]	http://www.wireless1.com.au/media/catalog/product/s/p/sp1210n.jpg	http://www.wireless1.com.au/accessories/printers/laser-black-white/lanier-sp1210n-b-w-laser-printer	79.00	
RAP1620B	489	2.4GHz wireless mouse | 1000 DPI | Approx 9 month battery life	Mice &amp; Mouse Mats	Rapoo	Rapoo 1620 2.4G Wireless Entry Level Mouse - Black	http://www.wireless1.com.au/media/catalog/product/r/a/rapoo_rp-1620b_1_.jpg	http://www.wireless1.com.au/accessories/desktop-accessories/mice/rapoo-1620-2-4g-wireless-entry-level-mouse-black	11.00	
RAPE2700B	490	Sturdy little keyboard with raised keys | Keyboard includes built-in touchpad 	Keyboards	Rapoo	Rapoo E2700 Bluetooth Ultra Touch Keyboard Black	http://www.wireless1.com.au/media/catalog/product/r/a/rapoo-e2700b_ps3.jpg	http://www.wireless1.com.au/accessories/desktop-accessories/keyboards/rapoo-e2700-bluetooth-ultra-touch-keyboard-black	42.00	
RAPE6100B	491	Bluetooth 3.0 | Connect to your iPad and Android Devices | Ultra Slim	Bluetooth Keyboards	Rapoo	Rapoo E6100 Bluetooth Keyboard Black	http://www.wireless1.com.au/media/catalog/product/r/a/rapoo_e6100b_3_.jpg	http://www.wireless1.com.au/accessories/tablet-accessories/bluetooth-keyboards/rapoo-e6100-bluetooth-keyboard-black	42.00	
RAPE6100W	492	Bluetooth 3.0 | Connect to your iPad and Android Devices | Ultra Slim	Bluetooth Keyboards	Rapoo	Rapoo E6100 Bluetooth Keyboard White	http://www.wireless1.com.au/media/catalog/product/r/a/rapoo_e6100w_1_.jpg	http://www.wireless1.com.au/accessories/tablet-accessories/bluetooth-keyboards/rapoo-e6100-bluetooth-keyboard-white	42.00	
RAPE9080B	493	2.4GHz Wireless connectoin | 5.6mm slim design	Keyboards	Rapoo	Rapoo E9080 2.4G Wireless Touchpad Keyboard Black	http://www.wireless1.com.au/media/catalog/product/r/a/rapoo_e9080_1_.jpg	http://www.wireless1.com.au/accessories/desktop-accessories/keyboards/rapoo-e9080-2-4g-wireless-touchpad-keyboard-black	45.00	
RAPH3070	494	Reliable 2.4G wireless connection up to 8 meters | Hidden omni-directional microphone	Headphones	Rapoo	Rapoo H3070 Wireless 2.4GHz Headset Black	http://www.wireless1.com.au/media/catalog/product/r/a/rapoo-h3070_ps4.jpg	http://www.wireless1.com.au/audio/audio/rapoo-h3070-wireless-2-4ghz-headset-blue		
RAPH6060	495	Bluetooth 2.1 | Touch Control | 16 Hours play	Headphones	Generic	Rapoo H6060 Bluetooth 2.1 Headset with Mic Black	http://www.wireless1.com.au/media/catalog/product/r/a/rapoo_h6060_1_.jpg	http://www.wireless1.com.au/audio/audio/rapoo-h6060-bluetooth-2-1-headset-with-mic-black	40.00	
RAPX1800B	496	2.4GHz wireless connection | Long battery | Media control	Mice &amp; Mouse Mats	Generic	Rapoo X1800 Wireless Optical Keyboard and Mouse	http://www.wireless1.com.au/media/catalog/product/x/1/x1800.jpg	http://www.wireless1.com.au/accessories/desktop-accessories/mice/rapoo-x1800-wireless-optical-keyboard-mouse	19.00	
SAMBHM1300HBEGXSA	497	Handsfree bluetooth headset | 8 hours of talk time | Built-in Multipoint Technology	Bluetooth Headsets	Samsung	Samsung HM1300 Mono Headset	http://www.wireless1.com.au/media/catalog/product/s/a/samsung_hm1300_1_.jpg	http://www.wireless1.com.au/accessories/mobile-phone-accessories/bluetooth-headsets/samsung-hm1300-mono-headset	29.00	
SAMHX-M101TCBG	498	Handy portable storage | Durable black design | SafetyKey protection for you data	Portable Hard Drives	Samsung	M3 Portable 1TB Exernal Hard Drive	http://www.wireless1.com.au/media/catalog/product/m/3/m3-portable-harddrive_1_.jpg	http://www.wireless1.com.au/accessories/storage/portable-hard-drives/m3-portable-1tb-exernal-hard-drive	89.00	
SAN32GBMICROSD	499	Store photos, videos and music on your mobile device | 32GB Capacity | Easy to transfer 	SD &amp; MicroSD Cards	SanDisk	SanDisk 32GB Class 4 microSD [ Memory Card ]	http://www.wireless1.com.au/media/catalog/product/s/a/sandisk-microsd-32gb_ps3.jpg	http://www.wireless1.com.au/accessories/storage/sd-microsd-cards/sandisk-32gb-micro-sd-memory-card	49.00	
SANCRUZERBLADE16GB	500	Cruzer Blade USB flash drive | 16GB	USB Sticks	SanDisk	SanDisk 16GB Cruzer Blade CZ50 USB 2.0 [ Flash Drive ]	http://www.wireless1.com.au/media/catalog/product/2/0/20101109223122_1.jpg	http://www.wireless1.com.au/accessories/storage/usb-sticks/sandisk-16gb-cruzer-cz50-blade	18.00	
SANCRUZERBLADE32GB	501	Cruzer Blade USB flash drive | 32GB	USB Sticks	SanDisk	SanDisk 32GB Cruzer Blade CZ50 USB 2.0 [ Flash Drive ]	http://www.wireless1.com.au/media/catalog/product/2/0/20101109223122_2.jpg	http://www.wireless1.com.au/accessories/storage/usb-sticks/sandisk-cruzer-blade-32gb-usb-flash-drive	28.00	
SANCRUZERBLADE8GB	502	Cruzer Blade USB flash drive | 8GB	USB Sticks	SanDisk	SanDisk 8GB Cruzer Blade CZ50 USB 2.0 [ Flash Drive ]	http://www.wireless1.com.au/media/catalog/product/2/0/20101109223122.jpg	http://www.wireless1.com.au/accessories/storage/usb-sticks/sandisk-8gb-cruzer-cz50-blade	9.00	
SANMICROSD16GB	503	Store photos, videos and music on your mobile device | 16GB Capacity | Easy to transfer 	SD &amp; MicroSD Cards	SanDisk	SanDisk microSD 16GB	http://www.wireless1.com.au/media/catalog/product/s/a/sandisk-microsd-16gb_ps1_1.jpg	http://www.wireless1.com.au/accessories/storage/sd-microsd-cards/sandisk-microsd-16gb	18.00	
SANMICROSD4GB	504	Store photos, videos and music on your mobile device | 4GB Capacity | Easy to transfer 	SD &amp; MicroSD Cards	SanDisk	SanDisk 4GB Class 4 microSD [ Memory Card ]	http://www.wireless1.com.au/media/catalog/product/s/a/sandisk-microsd-4gb_ps1.jpg	http://www.wireless1.com.au/accessories/storage/sd-microsd-cards/sandisk-microsd-4gb	8.00	
SANMICROSD8GB	505	Store photos, videos and music on your mobile device | 8GB Capacity | Easy to transfer 	SD &amp; MicroSD Cards	SanDisk	SanDisk 8GB Class 4 microSD [ Memory Card ]	http://www.wireless1.com.au/media/catalog/product/s/a/sandisk-microsd-8gb_ps1.jpg	http://www.wireless1.com.au/accessories/storage/sd-microsd-cards/sandisk-micro-sd-card-hc-8gb	14.95	
SANSDCZ50-064G-B35	506	Cruzer Blade USB flash drive | 64GB	USB Sticks	SanDisk	SanDisk 64GB Cruzer Blade CZ50 USB 2.0 [ Flash Drive ]	http://www.wireless1.com.au/media/catalog/product/2/0/20101109223122_3.jpg	http://www.wireless1.com.au/accessories/storage/usb-sticks/sandisk-cruzer-blade-usb-flash-drive-64gb	41.50	
SANSDSDQUA-016G-U46A	507	Class 10 | 16GB | Adapter included	SD &amp; MicroSD Cards	SanDisk	SanDisk 16GB Ultra Class 10 microSD with Adapter  [ Memory Card ]	http://www.wireless1.com.au/media/catalog/product/s/a/sandisk-ultra-microsd-16gb_1__1.jpg	http://www.wireless1.com.au/accessories/storage/sd-microsd-cards/sandisk-ultra-microsd-16gb-with-adapter	29.00	
SANSDSDQUA-032G	508	Speeds up to 30MB/s and highest available Class 10 speed rating | UHS Speed Class 1 (U1) 	SD &amp; MicroSD Cards	SanDisk	SanDisk 32GB Ultra Class 10 microSD with Adapter  [ Memory Card ]	http://www.wireless1.com.au/media/catalog/product/s/a/sandisk-mobile-ultra-32gb_ps1.jpg	http://www.wireless1.com.au/accessories/storage/sd-microsd-cards/sandisk-mobile-ultra-32gb-microsd-card	49.00	
SANSDSDQUA-064G	509	Speeds up to 30MB/s and highest available Class 10 speed rating | UHS Speed Class 1 (U1) 	SD &amp; MicroSD Cards	SanDisk	SanDisk 64GB Ultra Class 10 microSD with Adapter  [ Memory Card ]	http://www.wireless1.com.au/media/catalog/product/s/a/sandisk-mobile-ultra-64gb_ps1.jpg	http://www.wireless1.com.au/accessories/storage/sd-microsd-cards/sandisk-mobile-ultra-64gb-microsd-card	58.95	
SANULTRAMICROSD16GB	510	Class 10 and UHS-1 | 16GB | Adapter included	SD &amp; MicroSD Cards	SanDisk	SanDisk 16GB Ultra Class 10 microSD with Adapter [ Memory Card ]	http://www.wireless1.com.au/media/catalog/product/s/a/sandisk-ultra-microsd-16gb_1_.jpg	http://www.wireless1.com.au/accessories/storage/sd-microsd-cards/sandisk-ultra-microsd-16gb	24.95	
SANULTRAMICROSD32GB	511	Class 10 and UHS-1 | 32GB | Adapter included	SD &amp; MicroSD Cards	SanDisk	SanDisk 32GB Ultra Class 10 microSD with Adapter [ Memory Card ]	http://www.wireless1.com.au/media/catalog/product/s/a/sandisk-ultra-microsd-32gb_1_.jpg	http://www.wireless1.com.au/accessories/storage/sd-microsd-cards/sandisk-ultra-microsd-32gb	49.95	
SANULTRAMICROSD64GB	512	Class 10 and UHS-1 | 64GB | Adapter included	SD &amp; MicroSD Cards	SanDisk	SanDisk 64GB Ultra Class 10 microSD with Adapter [ Memory Card ]	http://www.wireless1.com.au/media/catalog/product/s/a/sandisk-ultra-microsd-64gb_1_.jpg	http://www.wireless1.com.au/accessories/storage/sd-microsd-cards/sandisk-ultra-microsd-64gb	89.95	
