SKU	Product ID	Short Description	Category Name	Brand	Model	Image Link	Product URL	Price	Shipment Costs
ASUF550CC-XO068H_RFB	5	Intel Core i5-3337U 1.8GHz | 15.6" (1366x768) | 4 GB RAM | 750 GB HDD | nVidia GeForce GT 720M 2GB | Windows 8	Oz-Bargain Stunner Deals	Asus	Asus F550CC-XO068H Refurbished Laptop	http://www.wireless1.com.au/media/catalog/product/i/m/image4_1.jpg	http://www.wireless1.com.au/ozbargain-specials/asus-f550cc-x0068h-refurbished-laptop	619.00	
ASUF550CC-XO069H_RFB	6	Intel Core i7-3537U 2.0GHz | 15.6" LED | 4GB RAM | 750GB HDD | nVidia GeForce GT 720M 2 GB | Windows 8	Refurbished	Asus	Asus F550CC-XO069H Refurbished Laptop	http://www.wireless1.com.au/media/catalog/product/i/m/image5_1_1.jpg	http://www.wireless1.com.au/laptops/laptop-type/refurbished/asus-f550cc-xo069h-refurbished-laptop	749.00	
ASUF550DP-XX008H_RFB	7	AMD A8 5550M 2.1GHz | 15.6" LED HD | 8GB RAM | 750GB HDD | Windows 8	Oz-Bargain Stunner Deals	Asus	Asus F550DP-XX008H Refurbished Laptop	http://www.wireless1.com.au/media/catalog/product/f/5/f550dp-xx008h-image-1.jpg	http://www.wireless1.com.au/ozbargain-specials/asus-f550dp-xx008h-refurbished-laptop	599.00	
ASUG750JX-T4061H	10	Intel Core i7-4700HQ 2.4GHz | 17.3" FHD | 32GB RAM | 2TB HDD | NVIDIA GeForce GTX 770M 3GB | Windows 8	Notebooks	Asus	Asus G750JX-T4061H Laptop	http://www.wireless1.com.au/media/catalog/product/g/7/g750_1_.jpg	http://www.wireless1.com.au/laptops/laptop-type/asus-g750jx-t4061h-laptop	2,249.00	
ASUK55DR-SX051H_RFB	15	AMD APU A8-4500M 1.90GHz (up to 2.80GHz) | 15.6" (1366x768) | 8GB RAM | 750GB HDD | Windows 8	Oz-Bargain Stunner Deals	Asus	Asus K55DR-SX051H Refurbished Laptop	http://www.wireless1.com.au/media/catalog/product/f/r/front_1.jpg	http://www.wireless1.com.au/ozbargain-specials/asus-k55dr-sx051h-refurbished-laptop	499.00	
ASUK56CB-XO389H_RFB	16	Intel Core i7-3537U 2.0GHz | 15.6" (1366x768) | 4GB RAM | 500GB HDD | NVIDIA GeForce GT 740M 2GB | Windows 8	Refurbished	Asus	Asus K56CB-XO389H Refurbished Laptop	http://www.wireless1.com.au/media/catalog/product/k/5/k56cb_1_.jpg	http://www.wireless1.com.au/laptops/laptop-type/refurbished/asus-k56cb-xo389h-refurbished-laptop	699.00	
ASUK56CM-XX164H_RFB	17	Intel Core i7-3517U | 15.6" (1366x768) | 4GB RAM | 1TB HDD | NVIDIA GeForce GT 635M 2GB | Windows 8	Refurbished	Asus	Asus K56CM-XX164H Refurbished Laptop	http://www.wireless1.com.au/media/catalog/product/i/m/image5_2.jpg	http://www.wireless1.com.au/laptops/laptop-type/refurbished/asus-k56cm-xx164h-refurbished-laptop	699.00	
ASUN750JV-T4184H	20	Intel Core i7-4700HQ 2.4GHz | 17.3" FHD LED | 16GB RAM | 3TB HDD | nVidia GeForce GT750M 4GB | Windows 8 	Notebooks	Asus	Asus N750JV-T4184H Laptop	http://www.wireless1.com.au/media/catalog/product/n/7/n750_2_.jpg	http://www.wireless1.com.au/laptops/laptop-type/asus-n750jv-t4184h-laptop	1,799.00	
ASUR505CA-XX204P_RFB	22	Intel Core i7-3537U 2GHz | 15.6" LED HD | 4GB RAM | 750GB HDD | Windows 8	Refurbished	Asus	Asus R505CA-XX204P Refurbished Laptop	http://www.wireless1.com.au/media/catalog/product/r/5/r505ca-xx204p-image1_1.jpg	http://www.wireless1.com.au/laptops/laptop-type/refurbished/asus-r505ca-xx204p-refurbished-laptop	699.00	
ASUT100TA-DK003H	23	Intel Atom Z3740 1.33 GHz | 10.1" Touch (1366 x 768) | 2GB RAM | 64GB eMMC HDD | Intel HD Graphics | Windows 8.1	Transformer	Asus	Asus T100TA-DK003H Transformer Book	http://www.wireless1.com.au/media/catalog/product/i/m/image2_5_1.jpg	http://www.wireless1.com.au/laptops/laptop-type/transformer/asus-transformer-book-t100ta-dk003h	489.00	
ASUT100TA-DK003H_RFB	24	Intel Atom Z3740 1.33 GHz | 10.1" Touch (1366 x 768) | 2GB RAM | 64GB eMMC HDD | Intel HD Graphics | Windows 8.1	Refurbished	Asus	Asus T100TA-DK003H Transformer Refurbished Laptop	http://www.wireless1.com.au/media/catalog/product/i/m/image2_5.jpg	http://www.wireless1.com.au/laptops/laptop-type/refurbished/asus-t100ta-dk003h-refurbished-laptop	399.00	
ASUTAICHI21-CW003H_RFB	25	Intel Core i5-3317U 1.7GHz | 11.6" Dual LED Screen (Touch Outer) | 4GB RAM | 128GB SSD | Windows 8	Refurbished	Asus	Asus TAICHI21-CW003H Refurbished Laptop	http://www.wireless1.com.au/media/catalog/product/t/a/taichi21_2.jpg	http://www.wireless1.com.au/laptops/laptop-type/refurbished/asus-taichi21-cw003h-refurbished-laptop	749.00	
ASUTAICHI21-CW015H_RFB	28	Intel Core i5-3337U 1.8GHz | 11.6" FHD Touch Screen (Outside) &amp; 11.6" FHD LED Screen (Inside) | 4GB RAM | 128GB SSD | Windows 8	Oz-Bargain Stunner Deals	Asus	Asus TAICHI21-CW015H Refurbished Laptop	http://www.wireless1.com.au/media/catalog/product/t/a/taichi21_3__2.jpg	http://www.wireless1.com.au/ozbargain-specials/asus-taichi21-cw015h-refurbished-laptop	699.00	
ASUTAICHI31-CX022H_RFB	31	Intel Core i5-3337U 2.7GHz | 13.3" Dual LED Screen (Touch Outer) | 4GB RAM | 128GB SSD | Windows 8	Oz-Bargain Stunner Deals	Asus	Asus TAICHI31-CX022H Refurbished Laptop	http://www.wireless1.com.au/media/catalog/product/t/a/taichi31_front.jpg	http://www.wireless1.com.au/ozbargain-specials/asus-taichi31-cx022h-refurbished-laptop	949.00	
ASUTX201LA-CQ004H	32	Intel Core i5 3337U Dock CPU + Intel Z2560 Tablet CPU | 11.6" LED Touch | 2GB RAM on Screen 4GB RAM on Dock | 16GB on Screen 500GB HDD on Dock | Windows 8	Transformer	Asus	Asus TX201LA-CQ004H Transformer	http://www.wireless1.com.au/media/catalog/product/d/b/dbac0aopavgiwj88_500.jpg	http://www.wireless1.com.au/laptops/laptop-type/transformer/asus-tx201la-cq004h-transformer	1,199.00	
ASUU38N-C4016H_RFB	33	AMD A8-4555M 1.6GHz | 13.3" Touch Screen Full HD | 4GB RAM | 128GB SSD | Windows 8	Oz-Bargain Stunner Deals	Asus	Asus U38N-C4016H Refurbished Laptop	http://www.wireless1.com.au/media/catalog/product/u/3/u38n-c4016h-image4.jpg	http://www.wireless1.com.au/ozbargain-specials/asus-u38n-c4016h-refurbished-laptop	699.00	
TOSPLM01A-00200C	42	Intel Celeron N2955U 1.4GHz | 13.3" HD LED Screen | 2GB RAM | 16GB SSD | CHROME OS	Notebooks	Toshiba	Toshiba CB30-002 13.3" Chromebook Laptop	http://www.wireless1.com.au/media/catalog/product/c/b/cb30-002-image1.jpg	http://www.wireless1.com.au/laptops/laptop-type/toshiba-cb30-002-laptop	339.00	
TOSPSKNEA-04G034	44	Intel Core i7-4700MQ 2.4GHz | 17.3" (1600x900) | 8GB RAM | 1TB HDD | NVIDIA GeForce GT 740M 2GB | Windows 8	Notebooks	Toshiba	Toshiba Satellite S70T-A04G Laptop	http://www.wireless1.com.au/media/catalog/product/s/7/s70t-a04g_1.jpg	http://www.wireless1.com.au/laptops/laptop-type/toshiba-satellite-s70t-a04g-laptop	1,399.00	
TOSPSKPSA-018023	45	AMD A6-5200 Quad Core 2.0GHz | 15.6" | 8GB DDR3 RAM | 750GB HDD | AMD Radeon HD 8400G | Windows 8	Notebooks	Toshiba	Toshiba Satellite U50D-A018 Laptop	http://www.wireless1.com.au/media/catalog/product/e/1/e1d0820bb499dffdc464365ec55d6d02.jpg	http://www.wireless1.com.au/laptops/laptop-type/toshiba-satellite-u50d-a018-laptop	699.00	
TOSPSPLPA-07T040	46	Intel Core i7-4700MQ 2.4GHz | 17.3" FHD (1920x1080) | 16GB RAM | 8GB SSD + 1TB HDD | NVIDIA GeForce GT 740M 2GB | Windows 8	Notebooks	Toshiba	Toshiba Satellite P70-A07T Laptop	http://www.wireless1.com.au/media/catalog/product/t/o/toshiba_p70-a07t_1_.jpg	http://www.wireless1.com.au/laptops/laptop-type/toshiba-satellite-p70-a07t-laptop	1,588.00	
TOSPSPLPA-08S040	47	Intel i7-4700MQ 2.4GHz | 17.3" | 16GB DDR3 RAM | 2TB HDD + 8GB SSD | NVIDIA GeForce GT745M 4GB | Windows 8	Notebooks	Toshiba	Toshiba P70-A08S Laptop	http://www.wireless1.com.au/media/catalog/product/p/7/p70-a08s-5.jpg	http://www.wireless1.com.au/laptops/laptop-type/toshiba-p70-a08s-laptop	2,099.00	
ASUDSL-N55U	50	This Modem Router suits ADSL2+ | Dual Band Wireless N | Wi-Fi speeds of up to 600Mbps | Strong Range | 2 x USB ports	Asus Cashback Promotion	Asus	Asus DSL-N55U Dual-band ADSL Modem Router N600	http://www.wireless1.com.au/media/catalog/product/d/s/dsl-n55u-dual-band-adsl-router-n600_1_1.jpg	http://www.wireless1.com.au/asus-cashback/asus-dsl-n55u-dual-band-adsl-modem-router-n600	124.00	
ASUEA-N66	51	This Adapter is Dual Band | Wireless N | Wi-Fi speeds of up to 900Mbps | Strong Range	Wireless Adaptors &amp; Dongles	Asus	Asus EA-N66 Wireless Gigabit Ethernet Adapter N450	http://www.wireless1.com.au/media/catalog/product/e/a/ea-n66_1.jpg	http://www.wireless1.com.au/networking/networking-products/asus-ea-n66-wireless-gigabit-ethernet-adapter-n450	99.00	
ASUPCE-AC68	52	This Adapter is Dual Band | Wireless AC | Wi-Fi speeds of up to 1900Mbps | Strong Range	Wireless Adaptors &amp; Dongles	Asus	Asus PCE-AC68 Dual Band Wi-Fi AC1900 Pci-e Adapter	http://www.wireless1.com.au/media/catalog/product/p/c/pce-ac68_1.jpg	http://www.wireless1.com.au/networking/networking-products/asus-pce-ac68-dualband-wifi-ac1900-pci-e-adapter	109.00	
ASURP-N53	53	This Range Extender is Dual Band | Wireless N | Wi-Fi speeds of up to 600Mbps | Strong Range	Wireless Range Extenders	Asus	Asus RP-N53 Dual-band WIRELESS-N600 Range Extender	http://www.wireless1.com.au/media/catalog/product/r/p/rp-n53_1.jpg	http://www.wireless1.com.au/networking/networking-products/asus-rp-n53-dual-band-wireless-n600-range-extender	89.00	
ASURT-AC66U	54	This Router suits Cable/NBN | Dual Band Wireless AC | Combined Dual Band Wi-Fi speeds of up to 1750Mbps | Strong Range | 2 x USB ports	Wireless Routers	Asus	Asus RT-AC66U Dual-band Wireless AC1750 Gigabit Router	http://www.wireless1.com.au/media/catalog/product/r/t/rt-ac66u_2_1.jpg	http://www.wireless1.com.au/networking/networking-products/asus-rt-ac66u-wireless-dual-band-gigabit-router	213.99	
ASURT-AC68U	55	This Router suits Cable/NBN | Dual Band Wireless AC | Wi-Fi speeds of up to 1900Mbps | Strong Range | 1 x USB 2.0 port | 1 x USB 3.0 port	Asus Cashback Promotion	Asus	Asus RT-AC68U  Dual Band  Wireless AC1900 GIGABYTE Router	http://www.wireless1.com.au/media/catalog/product/r/t/rt-ac68u_1_1.jpg	http://www.wireless1.com.au/asus-cashback/asus-rt-ac68u-ac1900-dual-band-router	235.00	
ASURT-N66U	56	This Router suits Cable/NBN | Wireless N | Combined Dual Band Wi-Fi speeds of up to 900Mbps | Strong Range | 2 x USB ports	Wireless Routers	Asus	Asus RT-N66U Wireless Dual-band N900 Gigabit Router	http://www.wireless1.com.au/media/catalog/product/r/t/rt-n66u_1.jpg	http://www.wireless1.com.au/networking/networking-products/asus-rt-n66u-dual-band-n900-gigabit-router	175.00	
ASUUSB-AC53	57	This USB Adapter is Dual Band | Wireless AC | Combined Dual Band Wi-Fi speeds of up to 300+867Mbps | Strong Range	Wireless Adaptors &amp; Dongles	Asus	Asus USB-AC53 Dual-band AC1200 USB Adapter	http://www.wireless1.com.au/media/catalog/product/u/s/usb-ac53_3.jpg	http://www.wireless1.com.au/networking/networking-products/asus-usb-ac53-dual-band-adapter	39.00	
ASUUSBN-13	58	This Wi-Fi USB Adapter is Single Band | Wireless N | Data rate of up to 300Mbps | Up to 150m Range	Wireless Adaptors &amp; Dongles	Asus	Asus USB-N13 Wireless N300 USB Adapter	http://www.wireless1.com.au/media/catalog/product/u/s/usb-n13_2.jpg	http://www.wireless1.com.au/networking/networking-products/asus-usb-n13-wireless-n-adapter-n300	18.99	
DLIDAP-1320	59	This Wi-Fi Range Extender is Single Band | Wireless N | Wi-Fi speeds of up to 300Mbps | Moderate Range 	Wireless Range Extenders	D-Link	D-Link DAP-1320 Wireless N300 Range Extender	http://www.wireless1.com.au/media/catalog/product/d/a/dap-1320_ps1.jpg	http://www.wireless1.com.au/networking/networking-products/d-link-dap-1320-wireless-n300-range-extender	35.00	
DLIDAP-1360	60	This Access Point is Single Band | Wireless N | Wi-Fi speeds of up to 300Mbps | Moderate Range 	Wireless Access Points	D-Link	D-Link DAP-1360 Wireless N300 Access Point	http://www.wireless1.com.au/media/catalog/product/d/a/dap-1360_ps4.jpg	http://www.wireless1.com.au/networking/networking-products/d-link-dap-1360-wireless-n-access-point	49.00	
DLIDAP-1650	61	This Wi-Fi Range Extender is Dual Band | Wireless AC | Combined Dual Band Wi-Fi speeds of up to 1.2 Gbps | Strong Range	Wireless Range Extenders	D-Link	D-Link DAP-1650 AC1200 Dual Band Range Extender	http://www.wireless1.com.au/media/catalog/product/d/a/dap-1650_ps1.jpg	http://www.wireless1.com.au/networking/networking-products/d-link-dap-1650-ac1200-dual-band-range-extender	119.00	
DLIDCS-2132L	62	HD Video Resolution up to 1280 x 800 | IR LEDs capture movements at Night | mydlink+ app for iOS &amp; Android | E-mail Alerts | View Angles up to 57.8 degrees Horizontal &amp; 37.8 degrees Vertical | Up to 10X Digital Zoom	Security Cameras	D-Link	D-Link DCS-2132L HD Cloud Camera	http://www.wireless1.com.au/media/catalog/product/d/c/dcs-2132l_ps1.jpg	http://www.wireless1.com.au/networking/networking-products/d-link-dcs-2132l-hd-cloud-camera	159.00	
DLIDCS-5010L	63	Video Resolution up to 640 x 480 | IR LEDs capture movements at Night | mydlink+ app for iOS and Android | Email Alerts | Pan Range up to 340 degrees | Tilt Range up to 120 degrees | 4X Digital Zoom	Security Cameras	D-Link	D-Link DCS-5010L Cloud Camera	http://www.wireless1.com.au/media/catalog/product/d/c/dcs-5010l_ps1.jpg	http://www.wireless1.com.au/networking/networking-products/d-link-dcs-5010l-cloud-camera	128.00	
DLIDCS-5020L	64	Video Resolution up to 480p | IR LEDs capture Night movements | App for iOS &amp; Android | Email Alerts | Pan Range up to 340 degrees | Tilt Range up to 120 degrees | Built-in Wi-Fi Extender | Sound &amp; Motion Detection	Security Cameras	D-Link	D-Link DCS-5020L Cloud Camera	http://www.wireless1.com.au/media/catalog/product/d/c/dcs-5020l_ps1.jpg	http://www.wireless1.com.au/networking/networking-products/d-link-dcs-5020l-cloud-camera	166.00	
DLIDCS-825L	65	This Wi-Fi Baby Camera has HD Resolution of 1280 x 720 | Lens Focal length of 3.3 mm | Wireless N | Built-in Microphone and Speaker | MicroSDHC Card Slot	D-Link Promo	D-Link	D-Link DCS-825L Wi-Fi Baby Camera Pink Blue Trim	http://www.wireless1.com.au/media/catalog/product/d/c/dcs-825l_ps1.jpg	http://www.wireless1.com.au/d-link-promo/d-link-dcs-825l-wifi-baby-camera-pink-blue-trim	178.98	
DLIDCS-930L	66	Video Resolution up to 640 x 480 | 1.0 lux Cmos Sensor captures movements in Low light | E-mail Alerts | View Angles up to 45.3 degrees Horizontal &amp; 34.5 degrees Vertical | Up to 4X Digital Zoom	Security Cameras	D-Link	D-Link DCS-930L Wireless N Network Camera	http://www.wireless1.com.au/media/catalog/product/d/c/dcs-930l_ps1.jpg	http://www.wireless1.com.au/networking/networking-products/d-link-dcs-930l-wireless-n-network-camera	38.99	
DLIDCS-932L	67	Video Resolution up to 640 x 480 | IR LEDs capture movements at Night | Automated E-mail Alerts | View Angles up to 45.3 degrees Horizontal &amp; 34.5 degrees Vertical | Up to 4X Digital Zoom	Security Cameras	D-Link	D-Link DCS-932L Cloud Camera	http://www.wireless1.com.au/media/catalog/product/d/c/dcs-932l_ps1.jpg	http://www.wireless1.com.au/networking/networking-products/d-link-dcs-932l-cloud-camera	74.00	
DLIDGS-1005A	68	This Switch has 5 x Gigabit LAN ports | Gigabit Ethernet Data Transfer Rates of up to 2000 Mbps (full duplex) | 10 Gbps Switching Fabric	Switches	D-Link	D-Link DGS-1005A 5 Port Gigabit Switch	http://www.wireless1.com.au/media/catalog/product/d/g/dgs-1005a_ps1.jpg	http://www.wireless1.com.au/networking/networking-products/d-link-dgs-1005a-5-port-gigabit-switch	19.00	
DLIDGS-1008A	69	This Switch has 8 x Gigabit Ethernet LAN ports | Gigabit Ethernet Data Transfer Rates of up to 2000 Mbps (full duplex) | 16 Gbps switching fabric	Switches	D-Link	D-Link DGS-1008A 8-Port Gigabit Easydesktop Switch	http://www.wireless1.com.au/media/catalog/product/d/g/dgs-1008a_ps1_1.jpg	http://www.wireless1.com.au/networking/networking-products/d-link-dgs-1008a-8-port-gigabit-easydesktop-switch	25.00	
DLIDGS-1016A	70	This Switch is Unmanaged | 16 x Gigabit ports | Gigabit Ethernet Data Transfer Rates of up to 2000 Mbps (full duplex) | Switching Capacity of up to 32 Gbps	Switches	D-Link	D-Link DGS-1016A 16 Port Gigabit Switch	http://www.wireless1.com.au/media/catalog/product/d/g/dgs-1016a-_ps1.jpg	http://www.wireless1.com.au/networking/networking-products/d-link-dgs-1016a-16-port-gigabit-switch	78.00	
DLIDGS-1016D	71	This Switch is Unmanaged | 16 x Gigabit ports | Gigabit Ethernet Data Transfer Rates of up to 2000 Mbps (full duplex) | Switching Capacity of up to 32 Gbps	Switches	D-Link	D-Link DGS-1016D 16 Port Gigabit Switch	http://www.wireless1.com.au/media/catalog/product/d/g/dgs-1016d_ps1.jpg	http://www.wireless1.com.au/networking/networking-products/d-link-dgs-1016d-16-port-gigabit-switch	97.50	
DLIDGS-1024A	72	This Switch is Unmanaged | 24 x Gigabit ports | Gigabit Ethernet Data Transfer Rates of up to 2000 Mbps (full duplex) | Switching Capacity of up to 48 Gbps	Switches	D-Link	D-Link DGS-1024A 24 Port Gigabit Switch	http://www.wireless1.com.au/media/catalog/product/d/g/dgs-1024a_ps1.jpg	http://www.wireless1.com.au/networking/networking-products/d-link-dgs-1024a-24-port-gigabit-switch	99.00	
DLIDGS-1024D	73	This Switch is Unmanaged | 24 x Gigabit ports | Gigabit Ethernet Data Transfer Rates of up to 2000 Mbps (full duplex) | 48 Gbps Switching Capacity 	Switches	D-Link	D-Link DGS-1024D 24 Port Gigabit Switch	http://www.wireless1.com.au/media/catalog/product/d/g/dgs-1024d_ps1.jpg	http://www.wireless1.com.au/networking/networking-products/d-link-dgs-1024d-24-port-gigabit-switch	118.99	
DLIDGS-105	74	This Switch is Unmanaged | 5 x Gigabit LAN ports | Gigabit Ethernet Data Transfer Rates of up to 2000 Mbps (full duplex) | 10 Gbps Switching Fabric	Switches	D-Link	D-Link DGS-105 5 Ports Gigabit Switch	http://www.wireless1.com.au/media/catalog/product/d/g/dgs-105_ps1.jpg	http://www.wireless1.com.au/networking/networking-products/d-link-dgs-105-5-ports-gigabit-switch	29.00	
DLIDGS-108	75	This Switch is Unmanaged | 8 x Gigabit LAN ports | Gigabit Ethernet Data Transfer Rates of up to 2000 Mbps (full duplex) | Store-and-forward Transmission Method | RAM Buffer of 128 KB per device 	Switches	D-Link	D-Link DGS-108 8-Port Gigabit Switch	http://www.wireless1.com.au/media/catalog/product/d/g/dgs-108_ps1.jpg	http://www.wireless1.com.au/networking/networking-products/d-link-dgs-108-8-port-gigabit-switch	38.99	
DLIDGS-1100-08P	76	This Switch has 8 x Gigabit ports | 16 Gbps Switching Capacity | Maximum Forwarding Rate of 11.9 Mpps | 2 MB Flash Memory | VoIP	Switches	D-Link	D-Link DGS-1100-08P Easysmart Switch	http://www.wireless1.com.au/media/catalog/product/d/g/dgs-1100-08p_ps4.jpg	http://www.wireless1.com.au/networking/networking-products/d-link-dgs-1100-08p-easysmart-switch	158.99	
DLIDHP-308AV	77	This Mini Adapter is HomePlug AV compliant | 10/100 Mbps Data Rate | 2 to 28 MHz Powerline Frequency Band 	Ethernet Over Power	D-Link	D-Link DHP-308AV Powerline AV 500 Mini Adapter	http://www.wireless1.com.au/media/catalog/product/d/h/dhp-308av_ps1.jpg	http://www.wireless1.com.au/networking/networking-products/d-link-dhp-308av-powerline-av-500-mini-adapter	39.00	
DLIDHP-309AV	78	This Powerline Network Kit is HomePlug AV compliant | Data speeds of up to 500Mbps | Ethernet 10/100 Mbps	Ethernet Over Power	D-Link	D-Link DHP-309AV Powerline AV 500 Mini Starter Kit	http://www.wireless1.com.au/media/catalog/product/d/h/dhp-309av_ps2_1.jpg	http://www.wireless1.com.au/networking/networking-products/d-link-dhp-309av-powerline-av-500-mini-starter-kit	68.00	
DLIDIR-505	79	This Wi-Fi Booster is Single band (2.4GHz) | Wireless N | WAN/LAN 10/100 Ethernet port | Internal Antenna	Wireless Range Extenders	D-Link	D-Link DIR-505 Wi-Fi Booster	http://www.wireless1.com.au/media/catalog/product/d/i/dir-505_ps1.jpg	http://www.wireless1.com.au/networking/networking-products/d-link-dir-505-wifi-booster	38.00	
DLIDIR-868L	80	This Router suits Cable/NBN | Dual Band Wireless AC | Combined Dual Band Wi-Fi speeds of up to 1.75Gbps | Strong Range | USB 3.0 port	D-Link Promo	D-Link	D-Link DIR-868L WIRELESS AC1750 DUAL BAND Gigabit Cloud Router	http://www.wireless1.com.au/media/catalog/product/d/i/dir-868l_ps1.jpg	http://www.wireless1.com.au/d-link-promo/d-link-dir-868l-gigabit-cloud-router	174.99	
DLIDNS-320L	81	This Network Storage Enclosure supports hard drives with capacities of 4 TB or above | Gigabit Ethernet port | USB 2.0 Host port	D-Link Promo	D-Link	D-Link DNS-320L Share Center Cloud Storage	http://www.wireless1.com.au/media/catalog/product/d/n/dns-320l_ps3.jpg	http://www.wireless1.com.au/d-link-promo/d-link-dns-320l-share-center-cloud-storage	98.98	
DLIDNS-327L	82	This Network Attached Storage (NAS) supports hard drives with capacities of 4 TB or above | USB 3.0 Host port | Gigabit Ethernet port	Network Attached Storage	D-Link	D-Link DNS-327L Sharecenter 2-Bay Cloud NAS Byod	http://www.wireless1.com.au/media/catalog/product/d/n/dns-327l_ps1.jpg	http://www.wireless1.com.au/networking/networking-products/d-link-dns-327l-sharecenter-2-bay-cloud-nas-byod	149.00	
DLIDSL-2544N	83	This Modem Router suits ADSL 2+ | Dual Band Wireless N | Combined Dual Band Wi-Fi speeds of up to 600 Mbps | Strong Range | USB port	D-Link Promo	D-Link	D-Link DSL-2544N Wireless Dual Band N600 ADSL2+ Gigabit Modem Router	http://www.wireless1.com.au/media/catalog/product/d/s/dsl-2544n_ps1.jpg	http://www.wireless1.com.au/d-link-promo/d-link-dsl-2544n-n600-dual-band-w-l-adsl2-m-r	95.00	
DLIDSL-2750B	84	This Modem Router suits ADSL 2+ | Single Band Wireless N | Wi-Fi speeds of up to 300Mbps | Moderate Range | 1 x USB port	Wireless Routers	D-Link	D-Link DSL-2750B Wireless N300 Modem Router	http://www.wireless1.com.au/media/catalog/product/d/s/dsl-2750b-promotion_ps1_1.jpg	http://www.wireless1.com.au/networking/networking-products/d-link-dsl-2750b-wireless-n300-modem-router	49.00	
DLIDSL-2870B	85	This Modem Router suits ADSL 2+ | Dual Band Wireless N | Combined Dual Band Wi-Fi speeds of up to 750Mbps | Strong Range | 1 x USB port 	Wireless Routers	D-Link	D-Link DSL-2870B Dual Band N750 Modem Router	http://www.wireless1.com.au/media/catalog/product/d/s/dsl-2870b_ps1.jpg	http://www.wireless1.com.au/networking/networking-products/d-link-dsl-2870b-dual-band-n750-modem-router	108.50	
DLIDSL-2875AL	86	This Modem Router suits ADSL 2+ | Dual Band Wireless AC | Combined Dual Band Wi-Fi speeds of up to 750Mbps | Strong Range	D-Link Promo	D-Link	D-Link DSL-2875AL Dual Band AC750 Modem Router	http://www.wireless1.com.au/media/catalog/product/d/s/dsl-2875al_ps1.jpg	http://www.wireless1.com.au/d-link-promo/d-link-dsl-2875al-dual-band-ac750-modem-router	118.00	
DLIDSL-2880AL	87	This Modem Router suits Cable/NBN and ADSL 2+ | Dual Band Wireless AC | Combined Dual Band Wi-Fi speeds of up to 1200Mbps | Strong Range | 1 x USB port 	Wireless Routers	D-Link	D-Link DSL-2880AL Dual Band AC1200 Modem Router	http://www.wireless1.com.au/media/catalog/product/d/s/dsl-2880al_ps1.jpg	http://www.wireless1.com.au/networking/networking-products/d-link-dsl-2880al-dual-band-ac1200-modem-router	149.00	
DLIDSL-2890AL	88	This Modem Router suits ADSL 2+ and Cable/NBN | Dual Band Wireless AC | Combined Dual Band Wi-Fi speeds of up to 1750 Mbps | Strong Range | USB 3.0 Port | USB 2.0 Port	D-Link Promo	D-Link	D-Link DSL-2890AL Dual Band AC1750 Cloud Modem Router	http://www.wireless1.com.au/media/catalog/product/d/s/dsl-2890al-promo_ps1_1.jpg	http://www.wireless1.com.au/d-link-promo/d-link-dsl-2890al-dual-band-ac1750-cloud-modem-rt	219.00	
DLIDSL-2890AL_RED	89	This Modem Router suits ADSL 2+ and Cable/NBN | Dual Band Wireless AC | Combined Dual Band Wi-Fi speeds of up to 1750 Mbps | Strong Range | USB 3.0 Port | USB 2.0 Port	D-Link Promo	D-Link	D-Link DSL-2890AL Wi-Fi AC1750 Modem Router Limited Edition Red	http://www.wireless1.com.au/media/catalog/product/d/s/dsl-2890al-red-promo_ps1.jpg	http://www.wireless1.com.au/d-link-promo/d-link-dsl-2890al-wifi-ac1750-m-r-ltd-edt-red	219.00	
DLIDUB-1312	90	This Ethernet Adapter has a RJ-45 Ethernet Port Interface | Gigabit | Transfer Data speeds of up to 1 Gbps 	Wireless Adaptors &amp; Dongles	D-Link	D-Link DUB-1312 USB 3.0 Gigabit Ethernet Adapter	http://www.wireless1.com.au/media/catalog/product/d/u/dub-1312_ps2.jpg	http://www.wireless1.com.au/networking/networking-products/d-link-dub-1312-usb-3-0-gigabit-ethernet-adapter	35.00	
DLIDUB-1340	91	This Hub has 4 x USB 3.0 ports | Transfer Rates of up to 5Gbps | Up to 900mA of Power per port | Backward compatibility with USB 2.0 	USB Hubs	D-Link	D-Link DUB-1340 4-Ports USB 3.0 Hub	http://www.wireless1.com.au/media/catalog/product/d/u/dub-1340_ps1.jpg	http://www.wireless1.com.au/accessories/laptop-accessories/usb-hubs/d-link-dub-1340-4-ports-usb-3-0-hub	59.00	
DLIDWA-131	92	This Wi-Fi USB Adapter is Single Band | Wireless N | USB Interface | Moderate Range	Wireless Adaptors &amp; Dongles	D-Link	D-Link DWA-131 Wireless N300 Nano USB Adapter	http://www.wireless1.com.au/media/catalog/product/d/w/dwa-131_ps1.jpg	http://www.wireless1.com.au/networking/networking-products/d-link-dwa-131-wireless-n300-nano-usb-adapter	19.00	
DLIDWA-140	93	This RangeBooster Adapter is Single Band (2.4 GHz) | Wireless N | USB 2.0 connector | Moderate Range 	Wireless Adaptors &amp; Dongles	D-Link	D-Link DWA-140 Wireless N300 Rangebooster Adapter	http://www.wireless1.com.au/media/catalog/product/d/w/dwa-140_ps1.jpg	http://www.wireless1.com.au/networking/networking-products/d-link-dwa-140-wireless-n300-rangebooster-adapter	19.00	
DLIDWA-160	94	This Wi-Fi Adapter is Dual Band | Wireless N | VoIP | Backward compatible with 802.11g devices | Strong Range 	Wireless Adaptors &amp; Dongles	D-Link	D-Link DWA-160 Xtreme N Dual Band Wireless Adapter	http://www.wireless1.com.au/media/catalog/product/d/w/dwa-160_ps1.jpg	http://www.wireless1.com.au/networking/networking-products/d-link-dwa-160-xtreme-n-dual-band-wireless-adapter	29.00	
DLIDWA-182	95	This Wi-Fi USB Adapter is Dual Band | Wireless AC | Combined Dual Band Wi-Fi speeds of up to 300Mbps + 867Mbps | Strong Range	Wireless Adaptors &amp; Dongles	D-Link	D-Link DWA-182 Wireless AC1200 Dual Band USB	http://www.wireless1.com.au/media/catalog/product/d/w/dwa-182_ps1.jpg	http://www.wireless1.com.au/networking/networking-products/d-link-dwa-182-wireless-ac1200-dual-band-usb	59.00	
